{
  "schema_version": "1.0",
  "original_question": "How many ACs concern test writing? Exclude parent requirements.",
  "source_scope": {
    "allow_retrieval": false,
    "read_roots": [
      "docs",
      "kernel",
      "knowledge",
      "integrations"
    ],
    "repository": "leafcutter",
    "source_revision": "planning-probe-only"
  },
  "selections": {
    "entity_types": [
      "ac"
    ],
    "target_ids": [],
    "required_fields": [
      "criteria",
      "parent"
    ],
    "document_types": [
      "ac_yaml"
    ],
    "relationships": []
  },
  "uncertain": {
    "entity_types": [],
    "target_ids": [
      "TQ-500"
    ],
    "required_fields": [],
    "document_types": [],
    "relationships": []
  },
  "detail_mode": "fields",
  "completeness": "exhaustive_count",
  "hierarchy_scope": "exclude_parents",
  "scope_resolution": "discovery_needed",
  "unresolved": [],
  "rationale": "The count requires discovering the complete population whose criteria concern test writing and using the hierarchy's parent identities to exclude every requirement that is a parent. The supplied TQ-500 observation is only a candidate family and cannot bound this topic. A missing exhaustive list of IDs is a discovery need, not a missing user preference.",
  "engine": "host_llm",
  "status": "decided",
  "model_id": null
}
