{
  "schema_version": "1.0",
  "original_question": "For KM-500c-2, what must tests demonstrate?",
  "source_scope": {
    "allow_retrieval": false,
    "read_roots": [
      "docs",
      "kernel",
      "knowledge",
      "integrations"
    ],
    "repository": "leafcutter",
    "source_revision": "planning-probe-only"
  },
  "selections": {
    "entity_types": [
      "ac"
    ],
    "target_ids": [
      "KM-500c-2"
    ],
    "required_fields": [
      "test_spec"
    ],
    "document_types": [
      "ac_yaml"
    ],
    "relationships": []
  },
  "uncertain": {
    "entity_types": [],
    "target_ids": [],
    "required_fields": [],
    "document_types": [],
    "relationships": []
  },
  "detail_mode": "fields",
  "completeness": "single_entity",
  "hierarchy_scope": "not_applicable",
  "scope_resolution": "sufficient",
  "unresolved": [],
  "rationale": "The question asks for the prescribed testing obligations of the one named acceptance criterion. Its test_spec supplies what tests must demonstrate. Declared test links, actual execution results, hierarchy populations and implementation progress are not requested.",
  "engine": "host_llm",
  "status": "decided",
  "model_id": null
}
